{
  "id": "presentation-data-to-decisions",
  "type": "presentation",
  "title": "From Data to Decisions",
  "summary": "A lecture deck on structuring decisions, evaluating evidence and communicating recommendations.",
  "courseId": "data-driven-decision-making",
  "duration": "60 minutes",
  "format": "Presentation outline",
  "status": "published",
  "file": "files/materials/presentation-data-to-decisions.md",
  "updated": "2026-07-21",
  "license": "CC BY 4.0",
  "rightsNotes": "Third-party trademarks, images, datasets and quoted material remain subject to their respective rights."
}
