{
  "id": "case-retail-growth-dashboard",
  "type": "case-study",
  "title": "The Retail Growth Dashboard",
  "summary": "A management team must decide which performance signals deserve action when revenue and customer metrics point in different directions.",
  "courseId": "business-analytics",
  "duration": "75 minutes",
  "format": "Student case and discussion questions",
  "status": "published",
  "file": "files/materials/case-retail-growth-dashboard.md",
  "updated": "2026-07-21",
  "license": "CC BY 4.0",
  "rightsNotes": "Third-party trademarks, images, datasets and quoted material remain subject to their respective rights."
}
