{
  "id": "case-evidence-conflict",
  "type": "case-study",
  "title": "When the Evidence Conflicts",
  "summary": "A leadership team must reconcile experimental results, customer feedback and commercial pressure before approving a new initiative.",
  "courseId": "business-science",
  "duration": "75 minutes",
  "format": "Decision case",
  "status": "published",
  "file": "files/materials/case-evidence-conflict.md",
  "updated": "2026-07-21",
  "license": "CC BY 4.0",
  "rightsNotes": "Third-party trademarks, images, datasets and quoted material remain subject to their respective rights."
}
