{
  "id": "presentation-digital-roadmap",
  "type": "presentation",
  "title": "Designing a Digital Transformation Roadmap",
  "summary": "A manager-focused presentation on priorities, sequencing, operating-model change and value delivery.",
  "courseId": "digital-transformation-managers",
  "duration": "75 minutes",
  "format": "Presentation outline",
  "status": "published",
  "file": "files/materials/presentation-digital-roadmap.md",
  "updated": "2026-07-21",
  "license": "CC BY 4.0",
  "rightsNotes": "Third-party trademarks, images, datasets and quoted material remain subject to their respective rights."
}
